{ 
  "$schema": "https://raw.githubusercontent.com/ZakSir/HireMe/master/resumeSchema.json",
  "candidate": {
    "name": {
      "givenName" :"Danni",
      "surname": "Fargo"
    },
     "email": "hiredannifargo@gmail.com",
    "phone": 4252688126,
    "hobbies": [
      "Welding (GMAW, GTAW)",
      "Borosilicate Flameworking",
      "Piano",
      "Winning"
    ],
    "location": "Renton, WA"
},
"proficiencies": [
    
],
"experience": [
    
],
"objective": "Winning! among other things and stuff."
}
